{"platform": "fixture", "campaign": {"id": "a3-001", "name": "A3 — entities and invisibles"}, "steps": [{"step": 1, "channel": "email", "limits": {}, "variants": [{"id": "1A", "signal": "entities", "subject": "{{company}} &amp; you", "body": "Hi {{firstName}},\n\nit&#8217;s about {{company}} &mdash; worth a look?\n\nHernan"}, {"id": "1B", "signal": "invisible", "subject": "quick​ question", "body": "Hi {{firstName}},\n\nSaw your team at {{company}}.​\n\nHernan"}, {"id": "1C", "signal": "clean", "subject": "a clean one", "body": "Hi {{firstName}},\n\nNothing wrong here at {{company}}.\n\nHernan"}]}], "leads": [{"id": "L1", "email": "jane@acme.com", "first_name": "Jane", "company_name": "Acme", "payload": {"company": "Acme"}}]}